{
 "days": [
  {
   "d": "2025-07-01",
   "done": 0,
   "score": 0,
   "workedSec": 0
  },
  {
   "d": "2025-07-02",
   "done": 0,
   "score": 0,
   "workedSec": 0
  },
  {
   "d": "2025-07-03",
   "done": 0,
   "score": 0,
   "workedSec": 0
  },
  {
   "d": "2025-07-04",
   "done": 0,
   "score": 0,
   "workedSec": 0
  },
  {
   "d": "2025-07-05",
   "done": 0,
   "score": 0,
   "workedSec": 0
  },
  {
   "d": "2025-07-06",
   "done": 0,
   "score": 0,
   "workedSec": 0
  },
  {
   "d": "2025-07-07",
   "done": 0,
   "score": 0,
   "workedSec": 0
  },
  {
   "d": "2025-07-08",
   "done": 0,
   "score": 0,
   "workedSec": 0
  },
  {
   "d": "2025-07-09",
   "done": 0,
   "score": 0,
   "workedSec": 0
  },
  {
   "d": "2025-07-10",
   "done": 0,
   "score": 0,
   "workedSec": 0
  },
  {
   "d": "2025-07-11",
   "done": 0,
   "score": 0,
   "workedSec": 0
  },
  {
   "d": "2025-07-12",
   "done": 0,
   "score": 0,
   "workedSec": 0
  },
  {
   "d": "2025-07-13",
   "done": 0,
   "score": 0,
   "workedSec": 0
  },
  {
   "d": "2025-07-14",
   "done": 0,
   "score": 0,
   "workedSec": 0
  },
  {
   "d": "2025-07-15",
   "done": 0,
   "score": 0,
   "workedSec": 0
  },
  {
   "d": "2025-07-16",
   "done": 0,
   "score": 0,
   "workedSec": 0
  },
  {
   "d": "2025-07-17",
   "done": 0,
   "score": 0,
   "workedSec": 0
  },
  {
   "d": "2025-07-18",
   "done": 0,
   "score": 0,
   "workedSec": 0
  },
  {
   "d": "2025-07-19",
   "done": 0,
   "score": 0,
   "workedSec": 0
  },
  {
   "d": "2025-07-20",
   "done": 0,
   "score": 0,
   "workedSec": 0
  },
  {
   "d": "2025-07-21",
   "done": 0,
   "score": 0,
   "workedSec": 0
  },
  {
   "d": "2025-07-22",
   "done": 0,
   "score": 0,
   "workedSec": 0
  },
  {
   "d": "2025-07-23",
   "done": 0,
   "score": 0,
   "workedSec": 0
  },
  {
   "d": "2025-07-24",
   "done": 0,
   "score": 0,
   "workedSec": 0
  },
  {
   "d": "2025-07-25",
   "done": 0,
   "score": 0,
   "workedSec": 0
  },
  {
   "d": "2025-07-26",
   "done": 0,
   "score": 0,
   "workedSec": 0
  },
  {
   "d": "2025-07-27",
   "done": 0,
   "score": 0,
   "workedSec": 0
  },
  {
   "d": "2025-07-28",
   "done": 0,
   "score": 0,
   "workedSec": 0
  },
  {
   "d": "2025-07-29",
   "done": 0,
   "score": 0,
   "workedSec": 0
  },
  {
   "d": "2025-07-30",
   "done": 0,
   "score": 0,
   "workedSec": 0
  },
  {
   "d": "2025-07-31",
   "done": 0,
   "score": 0,
   "workedSec": 0
  },
  {
   "d": "2025-08-01",
   "done": 0,
   "score": 0,
   "workedSec": 0
  },
  {
   "d": "2025-08-02",
   "done": 0,
   "score": 0,
   "workedSec": 0
  },
  {
   "d": "2025-08-03",
   "done": 0,
   "score": 0,
   "workedSec": 0
  },
  {
   "d": "2025-08-04",
   "done": 0,
   "score": 0,
   "workedSec": 0
  },
  {
   "d": "2025-08-05",
   "done": 0,
   "score": 0,
   "workedSec": 0
  },
  {
   "d": "2025-08-06",
   "done": 0,
   "score": 0,
   "workedSec": 0
  },
  {
   "d": "2025-08-07",
   "done": 0,
   "score": 0,
   "workedSec": 0
  },
  {
   "d": "2025-08-08",
   "done": 0,
   "score": 0,
   "workedSec": 0
  },
  {
   "d": "2025-08-09",
   "done": 0,
   "score": 0,
   "workedSec": 0
  },
  {
   "d": "2025-08-10",
   "done": 0,
   "score": 0,
   "workedSec": 0
  },
  {
   "d": "2025-08-11",
   "done": 0,
   "score": 0,
   "workedSec": 0
  },
  {
   "d": "2025-08-12",
   "done": 0,
   "score": 0,
   "workedSec": 0
  },
  {
   "d": "2025-08-13",
   "done": 0,
   "score": 0,
   "workedSec": 0
  },
  {
   "d": "2025-08-14",
   "done": 0,
   "score": 0,
   "workedSec": 0
  },
  {
   "d": "2025-08-15",
   "done": 0,
   "score": 0,
   "workedSec": 0
  },
  {
   "d": "2025-08-16",
   "done": 0,
   "score": 0,
   "workedSec": 0
  },
  {
   "d": "2025-08-17",
   "done": 0,
   "score": 0,
   "workedSec": 0
  },
  {
   "d": "2025-08-18",
   "done": 0,
   "score": 0,
   "workedSec": 0
  },
  {
   "d": "2025-08-19",
   "done": 0,
   "score": 0,
   "workedSec": 0
  },
  {
   "d": "2025-08-20",
   "done": 0,
   "score": 0,
   "workedSec": 0
  },
  {
   "d": "2025-08-21",
   "done": 0,
   "score": 0,
   "workedSec": 0
  },
  {
   "d": "2025-08-22",
   "done": 0,
   "score": 0,
   "workedSec": 0
  },
  {
   "d": "2025-08-23",
   "done": 0,
   "score": 0,
   "workedSec": 0
  },
  {
   "d": "2025-08-24",
   "done": 0,
   "score": 0,
   "workedSec": 0
  },
  {
   "d": "2025-08-25",
   "done": 0,
   "score": 0,
   "workedSec": 0
  },
  {
   "d": "2025-08-26",
   "done": 0,
   "score": 0,
   "workedSec": 0
  },
  {
   "d": "2025-08-27",
   "done": 0,
   "score": 0,
   "workedSec": 0
  },
  {
   "d": "2025-08-28",
   "done": 0,
   "score": 0,
   "workedSec": 0
  },
  {
   "d": "2025-08-29",
   "done": 0,
   "score": 0,
   "workedSec": 0
  },
  {
   "d": "2025-08-30",
   "done": 0,
   "score": 0,
   "workedSec": 0
  },
  {
   "d": "2025-08-31",
   "done": 0,
   "score": 0,
   "workedSec": 0
  },
  {
   "d": "2025-09-01",
   "done": 0,
   "score": 0,
   "workedSec": 0
  },
  {
   "d": "2025-09-02",
   "done": 0,
   "score": 0,
   "workedSec": 0
  },
  {
   "d": "2025-09-03",
   "done": 0,
   "score": 0,
   "workedSec": 0
  },
  {
   "d": "2025-09-04",
   "done": 0,
   "score": 0,
   "workedSec": 0
  },
  {
   "d": "2025-09-05",
   "done": 0,
   "score": 0,
   "workedSec": 0
  },
  {
   "d": "2025-09-06",
   "done": 0,
   "score": 0,
   "workedSec": 0
  },
  {
   "d": "2025-09-07",
   "done": 0,
   "score": 0,
   "workedSec": 0
  },
  {
   "d": "2025-09-08",
   "done": 0,
   "score": 0,
   "workedSec": 0
  },
  {
   "d": "2025-09-09",
   "done": 0,
   "score": 0,
   "workedSec": 0
  },
  {
   "d": "2025-09-10",
   "done": 0,
   "score": 0,
   "workedSec": 0
  },
  {
   "d": "2025-09-11",
   "done": 0,
   "score": 0,
   "workedSec": 0
  },
  {
   "d": "2025-09-12",
   "done": 0,
   "score": 0,
   "workedSec": 0
  },
  {
   "d": "2025-09-13",
   "done": 0,
   "score": 0,
   "workedSec": 0
  },
  {
   "d": "2025-09-14",
   "done": 0,
   "score": 0,
   "workedSec": 0
  },
  {
   "d": "2025-09-15",
   "done": 0,
   "score": 0,
   "workedSec": 0
  },
  {
   "d": "2025-09-16",
   "done": 0,
   "score": 0,
   "workedSec": 0
  },
  {
   "d": "2025-09-17",
   "done": 0,
   "score": 0,
   "workedSec": 0
  },
  {
   "d": "2025-09-18",
   "done": 0,
   "score": 0,
   "workedSec": 0
  },
  {
   "d": "2025-09-19",
   "done": 0,
   "score": 0,
   "workedSec": 0
  },
  {
   "d": "2025-09-20",
   "done": 0,
   "score": 0,
   "workedSec": 0
  },
  {
   "d": "2025-09-21",
   "done": 0,
   "score": 0,
   "workedSec": 0
  },
  {
   "d": "2025-09-22",
   "done": 0,
   "score": 0,
   "workedSec": 0
  },
  {
   "d": "2025-09-23",
   "done": 0,
   "score": 0,
   "workedSec": 0
  },
  {
   "d": "2025-09-24",
   "done": 0,
   "score": 0,
   "workedSec": 0
  },
  {
   "d": "2025-09-25",
   "done": 0,
   "score": 0,
   "workedSec": 0
  },
  {
   "d": "2025-09-26",
   "done": 0,
   "score": 0,
   "workedSec": 0
  },
  {
   "d": "2025-09-27",
   "done": 0,
   "score": 0,
   "workedSec": 0
  },
  {
   "d": "2025-09-28",
   "done": 0,
   "score": 0,
   "workedSec": 0
  },
  {
   "d": "2025-09-29",
   "done": 0,
   "score": 0,
   "workedSec": 0
  },
  {
   "d": "2025-09-30",
   "done": 0,
   "score": 0,
   "workedSec": 0
  },
  {
   "d": "2025-10-01",
   "done": 0,
   "score": 0,
   "workedSec": 0
  },
  {
   "d": "2025-10-02",
   "done": 0,
   "score": 0,
   "workedSec": 0
  },
  {
   "d": "2025-10-03",
   "done": 0,
   "score": 0,
   "workedSec": 0
  },
  {
   "d": "2025-10-04",
   "done": 0,
   "score": 0,
   "workedSec": 0
  },
  {
   "d": "2025-10-05",
   "done": 0,
   "score": 0,
   "workedSec": 0
  },
  {
   "d": "2025-10-06",
   "done": 0,
   "score": 0,
   "workedSec": 0
  },
  {
   "d": "2025-10-07",
   "done": 0,
   "score": 0,
   "workedSec": 0
  },
  {
   "d": "2025-10-08",
   "done": 0,
   "score": 0,
   "workedSec": 0
  },
  {
   "d": "2025-10-09",
   "done": 0,
   "score": 0,
   "workedSec": 0
  },
  {
   "d": "2025-10-10",
   "done": 0,
   "score": 0,
   "workedSec": 0
  },
  {
   "d": "2025-10-11",
   "done": 0,
   "score": 0,
   "workedSec": 0
  },
  {
   "d": "2025-10-12",
   "done": 0,
   "score": 0,
   "workedSec": 0
  },
  {
   "d": "2025-10-13",
   "done": 0,
   "score": 0,
   "workedSec": 0
  },
  {
   "d": "2025-10-14",
   "done": 0,
   "score": 0,
   "workedSec": 0
  },
  {
   "d": "2025-10-15",
   "done": 0,
   "score": 0,
   "workedSec": 0
  },
  {
   "d": "2025-10-16",
   "done": 0,
   "score": 0,
   "workedSec": 0
  },
  {
   "d": "2025-10-17",
   "done": 0,
   "score": 0,
   "workedSec": 0
  },
  {
   "d": "2025-10-18",
   "done": 0,
   "score": 0,
   "workedSec": 0
  },
  {
   "d": "2025-10-19",
   "done": 0,
   "score": 0,
   "workedSec": 0
  },
  {
   "d": "2025-10-20",
   "done": 0,
   "score": 0,
   "workedSec": 0
  },
  {
   "d": "2025-10-21",
   "done": 0,
   "score": 0,
   "workedSec": 0
  },
  {
   "d": "2025-10-22",
   "done": 0,
   "score": 0,
   "workedSec": 0
  },
  {
   "d": "2025-10-23",
   "done": 0,
   "score": 0,
   "workedSec": 0
  },
  {
   "d": "2025-10-24",
   "done": 0,
   "score": 0,
   "workedSec": 0
  },
  {
   "d": "2025-10-25",
   "done": 0,
   "score": 0,
   "workedSec": 0
  },
  {
   "d": "2025-10-26",
   "done": 0,
   "score": 0,
   "workedSec": 0
  },
  {
   "d": "2025-10-27",
   "done": 0,
   "score": 0,
   "workedSec": 0
  }
 ],
 "maxSec": 0,
 "spanDays": 119,
 "ts": 1761599990,
 "v": 1
}
